{
  "schemaVersion": "1.0.0",
  "companySlug": "samsung-sds",
  "mode": "portfolio-render",
  "buildId": "samsung-sds-v4",
  "generatedAt": "2026-08-18T16:09:56.398Z",
  "browser": "C:\\Program Files\\Google\\Chrome\\Application\\chrome.exe",
  "inputLockSha256": "028dbe86213ec5871e4956d7796bcde5741849fd881378f8465300ce9215654d",
  "sourceManifestSha256": "1156432c463b909313b078e5a899dca84cba1fc2e28fd942a21c6b1de9a8b4a8",
  "outputs": [
    {
      "kind": "fixture",
      "name": "neutral-sparse",
      "html": "fixtures/neutral-sparse/sparse.html",
      "htmlSha256": "d21442931561e4e98cbde96d3d966ecd8805ad802dacd18d9599961f88f7e288",
      "png": "fixtures/neutral-sparse/sparse.png",
      "pngSha256": "6b278b87c81e90ddd1fd0ded6cfa71866c806425def52f7fe5ad24a26f2e38fb",
      "pdf": "fixtures/neutral-sparse/sparse.pdf",
      "pdfSha256": "5380abbd20ac7ab8aac20e676314f620855ee38c4e76723abec2add784bd6f83",
      "png1280x720": true,
      "pdfNonEmpty": true,
      "overflowFree": true,
      "textProbesPassed": true
    },
    {
      "kind": "fixture",
      "name": "company-sparse",
      "html": "fixtures/company-sparse/sparse.html",
      "htmlSha256": "8f843741633dcd506e9ae553cb7ee0ed777bdbc8e225d99e7d6cc049f4427008",
      "png": "fixtures/company-sparse/sparse.png",
      "pngSha256": "a2a847b941ef2d87903eef928f37887bf5719e49f821fe527aa4ae7a62e59d0c",
      "pdf": "fixtures/company-sparse/sparse.pdf",
      "pdfSha256": "2c983ac325c41e2f6b04c01983c138beaac79006b31d68ee25eaa37ddc7bc3f2",
      "png1280x720": true,
      "pdfNonEmpty": true,
      "overflowFree": true,
      "textProbesPassed": true
    },
    {
      "kind": "fixture",
      "name": "neutral-dense",
      "html": "fixtures/neutral-dense/dense.html",
      "htmlSha256": "1f8a03805077e6033b4db5364ea32efabd5323f6a5e0fb1e6d3b2994f96bae81",
      "png": "fixtures/neutral-dense/dense.png",
      "pngSha256": "7b132ee0fb9dd6eb7bdc2540ecd4a066c5c048dc5b3935a4f935b31a84251bf2",
      "pdf": "fixtures/neutral-dense/dense.pdf",
      "pdfSha256": "a3516eef25190406a130d0712a22fa8fe1b39628b2ee4729832c11cd6448c315",
      "png1280x720": true,
      "pdfNonEmpty": true,
      "overflowFree": true,
      "textProbesPassed": true
    },
    {
      "kind": "fixture",
      "name": "company-dense",
      "html": "fixtures/company-dense/dense.html",
      "htmlSha256": "cc29d55bb72a53380d76860939324f5da267d40431b096b090a46f300afcfb55",
      "png": "fixtures/company-dense/dense.png",
      "pngSha256": "03d4b6bba092463821ff5cf96da162955a6d815147d87fd9992bd10c221200fe",
      "pdf": "fixtures/company-dense/dense.pdf",
      "pdfSha256": "0be3330c7bda856e217c1ca9caba6d1bff2924d0112021009dbf36a27ab6e3bc",
      "png1280x720": true,
      "pdfNonEmpty": true,
      "overflowFree": true,
      "textProbesPassed": true
    },
    {
      "kind": "page",
      "name": "01-cover",
      "html": "pages/01-cover.html",
      "htmlSha256": "2483270efb07724a6b645bf7eecb67284da66d21127c814a7e47d676ce9a2025",
      "png": "pages/01-cover.png",
      "pngSha256": "a13ab15f1a0aab978a3c55ee299a842821d856aa541d4d3d260eda92c9a5e3fa",
      "pdf": "pages/01-cover.pdf",
      "pdfSha256": "2aa80a0bc9b0a04e49165ea75c292f7b1d22c6fed1b54c28d7546d758cc0d31e",
      "png1280x720": true,
      "pdfNonEmpty": true,
      "overflowFree": true,
      "textProbesPassed": true
    }
  ],
  "checks": {
    "inputLockStable": true,
    "fixtureDomStable": true,
    "pageInventoryComplete": true,
    "fontsVerified": true,
    "allRendersValid": true,
    "overflowFree": true,
    "textExtractionVerified": true
  },
  "blockers": [],
  "outputSetSha256": "a697b93f39a736b0ffbe1d0fab741150d6d3275eb9f188f0a155b29e438396c4",
  "productionGateEligible": true
}
