{
  "schemaVersion": "1.0.0",
  "companySlug": "samsung-sds",
  "mode": "portfolio-render",
  "buildId": "samsung-sds-v3",
  "generatedAt": "2026-08-18T16:04:57.746Z",
  "browser": "C:\\Program Files\\Google\\Chrome\\Application\\chrome.exe",
  "inputLockSha256": "767841dd1385126f281d7127dc562f053d197e0d987693809d8856dba291338c",
  "sourceManifestSha256": "693dfa5e50637c84548d07808a2fef26adfce6f833a6d34d2c3fff8f613ff95f",
  "outputs": [
    {
      "kind": "fixture",
      "name": "neutral-sparse",
      "html": "fixtures/neutral-sparse/sparse.html",
      "htmlSha256": "2200d7cb3ea7e270474ffc94471475bcdb16098369664c70caae3f8c16477312",
      "png": "fixtures/neutral-sparse/sparse.png",
      "pngSha256": "6b278b87c81e90ddd1fd0ded6cfa71866c806425def52f7fe5ad24a26f2e38fb",
      "pdf": "fixtures/neutral-sparse/sparse.pdf",
      "pdfSha256": "328a137cbe90be35bf32c50ab1f93b8c8589fd390446fcb8869a5654e0a5a837",
      "png1280x720": true,
      "pdfNonEmpty": true,
      "overflowFree": true,
      "textProbesPassed": true
    },
    {
      "kind": "fixture",
      "name": "company-sparse",
      "html": "fixtures/company-sparse/sparse.html",
      "htmlSha256": "85bb100cb011fcb3ec690e3f617be2f52b272173014ef46b9bd31f2c6bc3fa8e",
      "png": "fixtures/company-sparse/sparse.png",
      "pngSha256": "a2a847b941ef2d87903eef928f37887bf5719e49f821fe527aa4ae7a62e59d0c",
      "pdf": "fixtures/company-sparse/sparse.pdf",
      "pdfSha256": "cc634765edcab4e61271147884381bed880671125a1e0d24448655f0da0abf01",
      "png1280x720": true,
      "pdfNonEmpty": true,
      "overflowFree": true,
      "textProbesPassed": true
    },
    {
      "kind": "fixture",
      "name": "neutral-dense",
      "html": "fixtures/neutral-dense/dense.html",
      "htmlSha256": "26f6f0941e7fec8e5f5054067053e321f188f56bc345978cae63dbfb9013b15d",
      "png": "fixtures/neutral-dense/dense.png",
      "pngSha256": "7b132ee0fb9dd6eb7bdc2540ecd4a066c5c048dc5b3935a4f935b31a84251bf2",
      "pdf": "fixtures/neutral-dense/dense.pdf",
      "pdfSha256": "e2eb4c4a24edeb71fa942e303b191b654a1591bd4c9cde3ada013bb433189569",
      "png1280x720": true,
      "pdfNonEmpty": true,
      "overflowFree": true,
      "textProbesPassed": true
    },
    {
      "kind": "fixture",
      "name": "company-dense",
      "html": "fixtures/company-dense/dense.html",
      "htmlSha256": "447b8e0da8553fec8b6f015d784a1ddd7d9f84628b006baa1f0862b09baf6b1f",
      "png": "fixtures/company-dense/dense.png",
      "pngSha256": "03d4b6bba092463821ff5cf96da162955a6d815147d87fd9992bd10c221200fe",
      "pdf": "fixtures/company-dense/dense.pdf",
      "pdfSha256": "f5a83a8a8920cff5bd06848b0e93fc6d8262bb99fc6cff299d526e8f4549c505",
      "png1280x720": true,
      "pdfNonEmpty": true,
      "overflowFree": true,
      "textProbesPassed": true
    },
    {
      "kind": "page",
      "name": "01-cover",
      "html": "pages/01-cover.html",
      "htmlSha256": "2483270efb07724a6b645bf7eecb67284da66d21127c814a7e47d676ce9a2025",
      "png": "pages/01-cover.png",
      "pngSha256": "a13ab15f1a0aab978a3c55ee299a842821d856aa541d4d3d260eda92c9a5e3fa",
      "pdf": "pages/01-cover.pdf",
      "pdfSha256": "f26f4dfc837b44c66fbece4ad17b47484c4f5061b0c7bde15444c2e331870258",
      "png1280x720": true,
      "pdfNonEmpty": true,
      "overflowFree": true,
      "textProbesPassed": true
    }
  ],
  "checks": {
    "inputLockStable": true,
    "fixtureDomStable": true,
    "pageInventoryComplete": true,
    "fontsVerified": true,
    "allRendersValid": true,
    "overflowFree": true,
    "textExtractionVerified": true
  },
  "blockers": [],
  "outputSetSha256": "45265fe5a98dfe84d890da4a7501b46eeffb4ad7fa4e9c229cc25913638795dd",
  "productionGateEligible": true
}
