{
  "schemaVersion": "1.0.0",
  "companySlug": "samsung-sds",
  "mode": "portfolio-render",
  "buildId": "samsung-sds-v2",
  "generatedAt": "2026-08-18T16:03:17.824Z",
  "browser": "C:\\Program Files\\Google\\Chrome\\Application\\chrome.exe",
  "inputLockSha256": "a994576d59ce6fa2da9690efb0e37dd857d8958781eea316304194dc78871563",
  "sourceManifestSha256": "693dfa5e50637c84548d07808a2fef26adfce6f833a6d34d2c3fff8f613ff95f",
  "outputs": [
    {
      "kind": "fixture",
      "name": "neutral-sparse",
      "html": "fixtures/neutral-sparse/sparse.html",
      "htmlSha256": "3705ec756585313af9ca9121200893dd860dcc080cf71ac6a68b87a30985540b",
      "png": "fixtures/neutral-sparse/sparse.png",
      "pngSha256": "6b278b87c81e90ddd1fd0ded6cfa71866c806425def52f7fe5ad24a26f2e38fb",
      "pdf": "fixtures/neutral-sparse/sparse.pdf",
      "pdfSha256": "7d43a4156fa4865def0eeee0c10d07c585a582ea1950b2ee85ab0cca496b1584",
      "png1280x720": true,
      "pdfNonEmpty": true,
      "overflowFree": true,
      "textProbesPassed": true
    },
    {
      "kind": "fixture",
      "name": "company-sparse",
      "html": "fixtures/company-sparse/sparse.html",
      "htmlSha256": "4574fa14a9a5372244bfdfbda05491a9271033420d3abd99092ede197843331a",
      "png": "fixtures/company-sparse/sparse.png",
      "pngSha256": "a2a847b941ef2d87903eef928f37887bf5719e49f821fe527aa4ae7a62e59d0c",
      "pdf": "fixtures/company-sparse/sparse.pdf",
      "pdfSha256": "d425a3a888c5aab7692fc165e43277cc7a7ae7b9e3fcbecda4e7f22c93917245",
      "png1280x720": true,
      "pdfNonEmpty": true,
      "overflowFree": true,
      "textProbesPassed": true
    },
    {
      "kind": "fixture",
      "name": "neutral-dense",
      "html": "fixtures/neutral-dense/dense.html",
      "htmlSha256": "1a88b57eddd8214ae1a1d90e4c3774d2588548029d0982e97e794ddb234b080d",
      "png": "fixtures/neutral-dense/dense.png",
      "pngSha256": "7b132ee0fb9dd6eb7bdc2540ecd4a066c5c048dc5b3935a4f935b31a84251bf2",
      "pdf": "fixtures/neutral-dense/dense.pdf",
      "pdfSha256": "93338cb7f86bf95d6e173e652c72023be3fb865015f0e34e9f535bc9dfe28982",
      "png1280x720": true,
      "pdfNonEmpty": true,
      "overflowFree": true,
      "textProbesPassed": true
    },
    {
      "kind": "fixture",
      "name": "company-dense",
      "html": "fixtures/company-dense/dense.html",
      "htmlSha256": "fe5fdc32539d6943026fc7b85f9512d3c5d7b7f3fdd01954f605008df2d58572",
      "png": "fixtures/company-dense/dense.png",
      "pngSha256": "03d4b6bba092463821ff5cf96da162955a6d815147d87fd9992bd10c221200fe",
      "pdf": "fixtures/company-dense/dense.pdf",
      "pdfSha256": "ad37486d7c7c5a2a260857c0afe4f9d358688af435290082fce57efc4b0e8c21",
      "png1280x720": true,
      "pdfNonEmpty": true,
      "overflowFree": true,
      "textProbesPassed": true
    },
    {
      "kind": "page",
      "name": "01-cover",
      "html": "pages/01-cover.html",
      "htmlSha256": "2483270efb07724a6b645bf7eecb67284da66d21127c814a7e47d676ce9a2025",
      "png": "pages/01-cover.png",
      "pngSha256": "a13ab15f1a0aab978a3c55ee299a842821d856aa541d4d3d260eda92c9a5e3fa",
      "pdf": "pages/01-cover.pdf",
      "pdfSha256": "d9cb1b677f595449022a25273df8ebb88a3c7d9c25db75fca728e26bb0106f94",
      "png1280x720": true,
      "pdfNonEmpty": true,
      "overflowFree": true,
      "textProbesPassed": true
    }
  ],
  "checks": {
    "inputLockStable": true,
    "fixtureDomStable": true,
    "pageInventoryComplete": true,
    "fontsVerified": true,
    "allRendersValid": true,
    "overflowFree": true,
    "textExtractionVerified": false
  },
  "blockers": [
    "PDF text, geometry, or font inspection failed"
  ],
  "outputSetSha256": "485a71ea00ab41c41822215a07b8b993323bc9a2368e1e0a708690ed58d7efe4",
  "productionGateEligible": false
}
